Categoria,Palavra-Chave,Volume Busca Mensal,CPC (R$),Dificuldade SEO,Tipo de Busca,Intenção,Prioridade
Harmonização Íntima Masculina,harmonização íntima masculina,2900,0.60,Média,Head Term,Comercial/Informativa,Alta
Harmonização Íntima Masculina,harmonização íntima masculina BH,NA,NA,Baixa,Local,Transacional,Alta
Harmonização Íntima Masculina,harmonização íntima masculina SP,NA,NA,Baixa,Local,Transacional,Alta
Harmonização Íntima Masculina,harmonização íntima masculina fotos,1300,0.31,Média,Long Tail,Informativa,Alta
Harmonização Íntima Masculina,harmonização íntima masculina antes e depois,1000,0.15,Média,Long Tail,Comercial,Alta
Harmonização Íntima Masculina,harmonização íntima masculina segura,NA,NA,Baixa,Long Tail,Informativa,Média
Harmonização Íntima Masculina,harmonização íntima masculina natural,NA,NA,Baixa,Long Tail,Comercial,Média
Harmonização Íntima Masculina,harmonização íntima masculina indolor,NA,NA,Baixa,Long Tail,Informativa,Média
Harmonização Íntima Masculina,harmonização íntima masculina preço,NA,NA,Baixa,Long Tail,Comercial,Alta
Harmonização Íntima Masculina,harmonização íntima masculina resultados,NA,NA,Baixa,Long Tail,Comercial,Média
Harmonização Íntima Feminina,harmonização íntima feminina,320,0.57,Média,Head Term,Comercial/Informativa,Média
Harmonização Íntima Feminina,harmonização íntima feminina antes e depois,320,0.57,Média,Long Tail,Comercial,Média
Harmonização Íntima Feminina,harmonização íntima feminina preço,NA,NA,Baixa,Long Tail,Comercial,Baixa
Harmonização Íntima Feminina,harmonização íntima feminina resultados,NA,NA,Baixa,Long Tail,Comercial,Baixa
Procedimento e Técnica,harmonização íntima com ácido hialurônico,10,0.74,Alta,Long Tail,Transacional,Alta
Procedimento e Técnica,harmonização íntima sem cirurgia,NA,NA,Baixa,Long Tail,Informativa,Média
Procedimento e Técnica,procedimento íntimo masculino,NA,NA,Baixa,Long Tail,Informativa,Média
Procedimento e Técnica,preenchimento íntimo masculino,NA,NA,Baixa,Long Tail,Comercial,Média
Procedimento e Técnica,técnica harmonização íntima,NA,NA,Baixa,Long Tail,Informativa,Baixa
Procedimento e Técnica,método Intimax,NA,NA,Baixa,Branded,Comercial,Alta
Perguntas de Busca (PAA),o que é harmonização íntima,14,NA,Baixa,Long Tail,Informativa,Alta
Perguntas de Busca (PAA),o que é harmonização íntima no homem,10,NA,Baixa,Long Tail,Informativa,Alta
Perguntas de Busca (PAA),quanto custa harmonização íntima masculina,NA,NA,Baixa,Long Tail,Comercial,Alta
Perguntas de Busca (PAA),quanto tempo dura harmonização íntima,NA,NA,Baixa,Long Tail,Informativa,Média
Perguntas de Busca (PAA),harmonização íntima masculina dói,NA,NA,Baixa,Long Tail,Informativa,Média
Perguntas de Busca (PAA),harmonização íntima masculina vale a pena,NA,NA,Baixa,Long Tail,Comercial,Alta
Perguntas de Busca (PAA),quem pode fazer harmonização íntima,NA,NA,Baixa,Long Tail,Informativa,Baixa
Autoestima e Bem-Estar,autoestima masculina,NA,NA,Baixa,Broad,Informativa,Média
Autoestima e Bem-Estar,confiança íntima masculina,NA,NA,Baixa,Long Tail,Emocional,Média
Autoestima e Bem-Estar,bem-estar masculino,NA,NA,Baixa,Broad,Informativa,Baixa
Autoestima e Bem-Estar,autocuidado masculino,NA,NA,Baixa,Broad,Informativa,Baixa
Autoestima e Bem-Estar,qualidade de vida masculina,NA,NA,Baixa,Broad,Informativa,Baixa
Rejuvenescimento Íntimo,rejuvenescimento íntimo masculino,NA,NA,Baixa,Long Tail,Comercial,Média
Rejuvenescimento Íntimo,rejuvenescimento íntimo feminino,NA,NA,Baixa,Long Tail,Comercial,Baixa
Rejuvenescimento Íntimo,estética íntima masculina,NA,NA,Baixa,Long Tail,Comercial,Média
Rejuvenescimento Íntimo,estética íntima feminina,NA,NA,Baixa,Long Tail,Comercial,Baixa
Full Face e Harmonização Facial,harmonização facial masculina,NA,NA,Média,Long Tail,Comercial,Baixa
Full Face e Harmonização Facial,full face masculino,NA,NA,Média,Long Tail,Comercial,Baixa
Full Face e Harmonização Facial,harmonização facial feminina,NA,NA,Média,Long Tail,Comercial,Baixa
Profissional e Autoridade,Dra Karina Rodovansky,NA,NA,Baixa,Branded,Comercial,Alta
Profissional e Autoridade,biomédica especialista harmonização íntima,NA,NA,Baixa,Long Tail,Informativa,Média
Profissional e Autoridade,especialista harmonização íntima masculina,NA,NA,Baixa,Long Tail,Comercial,Média
Profissional e Autoridade,melhor profissional harmonização íntima BH,NA,NA,Baixa,Local,Transacional,Média
Local - Belo Horizonte,harmonização íntima Belo Horizonte,NA,NA,Baixa,Local,Transacional,Alta
Local - Belo Horizonte,clínica harmonização íntima BH,NA,NA,Baixa,Local,Transacional,Alta
Local - Belo Horizonte,estética masculina Belo Horizonte,NA,NA,Baixa,Local,Comercial,Média
Local - Belo Horizonte,biomedicina estética BH,NA,NA,Baixa,Local,Informativa,Baixa
Local - São Paulo,harmonização íntima São Paulo,NA,NA,Baixa,Local,Transacional,Alta
Local - São Paulo,clínica harmonização íntima SP,NA,NA,Baixa,Local,Transacional,Alta
Local - São Paulo,estética masculina São Paulo,NA,NA,Baixa,Local,Comercial,Média
